{
  "schema_version": "1.0.0",
  "document": {
    "document_id": "co_demo001",
    "representative_standard_order_id": "so_demo001",
    "source_order_id": "DEMO-ORDER-001",
    "source_order_no": null,
    "process_instance_id": null,
    "case_content": "市民反映武进区阳光花园每天22时后有施工噪声，疑似由华建工程公司施工。",
    "case_goal": "希望住建部门核实并处理。",
    "title": null,
    "content_fingerprint": "aaaaaaaaaaaaaaaaaaaaaaaaaaaaaaaaaaaaaaaaaaaaaaaaaaaaaaaaaaaaaaaa",
    "metadata": {
      "tenant_id": "demo-tenant",
      "source_platform": "320400",
      "belong_department_id": null,
      "department_name": "受理科",
      "active_department_ids": null,
      "concluding_department_id": null,
      "appeal_department_id": null,
      "service_object_type": "投诉举报",
      "order_type": "个人",
      "order_source": "电话",
      "order_source_detail": "12345",
      "case_public": "否",
      "hotspot": null,
      "case_labels": null,
      "special_type": null,
      "form_type": "噪声污染",
      "knowledge_references": null,
      "classification": {
        "level1": "环境保护",
        "level2": "噪声污染",
        "level3": "建筑施工噪声",
        "level4": null,
        "level5": null,
        "code": null
      },
      "region": {
        "city": "常州市",
        "area": "武进区",
        "street": null,
        "area_code": "320412"
      },
      "address_detail": null,
      "lnglat": null,
      "order_status": "100",
      "first_order_status": null,
      "second_order_status": null,
      "atomic_order_status": null,
      "invalid_type": null,
      "deleted_flag": "0",
      "dispatch_accuracy": "1",
      "is_over_time": null,
      "is_sign_over_time": null,
      "back_count": "0",
      "call_time": "2025-03-15T22:30:00+08:00",
      "plan_finish_time": null,
      "case_complete_time": "2025-03-18T10:00:00+08:00",
      "order_finish_time": "2025-03-18T10:00:00+08:00",
      "plan_sign_time": null,
      "source_create_date": "2025-03-15T22:31:00+08:00",
      "source_update_date": "2025-03-18T10:01:00+08:00",
      "is_visit": "是",
      "urgency": "一般",
      "info_protect": "否",
      "first_visit_satisfied": "满意",
      "result_satisfied": "满意",
      "visit_result": "已回访",
      "return_visit_reason": null,
      "remark": null,
      "appeal_status": null,
      "appeal_feedback_date": null,
      "appeal_result_opinions": null,
      "visit_count": "1",
      "quality_flags": []
    },
    "schema_version": "1.0.0"
  },
  "occurrences": [
    {
      "occurrence_id": "occ_demo001",
      "document_id": "co_demo001",
      "standard_order_id": "so_demo001",
      "source_id": "demo001",
      "source_order_id": "DEMO-ORDER-001",
      "source_order_no": null,
      "complaint_cluster_id": "cc_demo001",
      "duplicate_class": "unique",
      "call_time": "2025-03-15T22:30:00+08:00",
      "schema_version": "1.0.0"
    }
  ],
  "events": [
    {
      "event_id": "evt_demo_issue",
      "document_id": "co_demo001",
      "event_kind": "ISSUE",
      "summary": "阳光花园每天22时后存在施工噪声",
      "event_type_code": null,
      "event_type_name": "建筑施工噪声",
      "polarity": "affirmed",
      "occurred_start": null,
      "occurred_end": null,
      "temporal_precision": "recurring",
      "temporal_text": "每天22时后",
      "time_source": "source_text",
      "requested_action": null,
      "provenance": {
        "source_document_id": "co_demo001",
        "extractor_type": "human",
        "extraction_run_id": "run_demo_v1",
        "model_name": null,
        "model_version": null,
        "prompt_version": null,
        "schema_version": "1.0.0",
        "confidence": 1.0,
        "review_status": "accepted",
        "source_spans": [
          {
            "field": "case_content",
            "start": 0,
            "end": 35,
            "text": "市民反映武进区阳光花园每天22时后有施工噪声，疑似由华建工程公司施工。",
            "redacted": true
          }
        ]
      },
      "schema_version": "1.0.0"
    },
    {
      "event_id": "evt_demo_request",
      "document_id": "co_demo001",
      "event_kind": "SERVICE_REQUEST",
      "summary": "请求住建部门核实并处理施工噪声",
      "event_type_code": null,
      "event_type_name": "核实处理",
      "polarity": "affirmed",
      "occurred_start": "2025-03-15T22:30:00+08:00",
      "occurred_end": null,
      "temporal_precision": "exact",
      "temporal_text": null,
      "time_source": "call_time_fallback",
      "requested_action": "核实并处理",
      "provenance": {
        "source_document_id": "co_demo001",
        "extractor_type": "human",
        "extraction_run_id": "run_demo_v1",
        "model_name": null,
        "model_version": null,
        "prompt_version": null,
        "schema_version": "1.0.0",
        "confidence": 1.0,
        "review_status": "accepted",
        "source_spans": [
          {
            "field": "case_goal",
            "start": 0,
            "end": 12,
            "text": "希望住建部门核实并处理。",
            "redacted": true
          }
        ]
      },
      "schema_version": "1.0.0"
    }
  ],
  "entities": [
    {
      "entity_id": "ent_wujin",
      "entity_type": "LOCATION",
      "entity_subtype": "DISTRICT",
      "canonical_name": "武进区",
      "normalized_name": "武进区",
      "aliases": ["武进区"],
      "administrative_code": "320412",
      "parent_entity_id": null,
      "sensitivity": "public",
      "attributes": {"city": "常州市"},
      "resolution": {
        "method": "dictionary",
        "confidence": 1.0,
        "review_status": "accepted",
        "resolver_version": "demo-v1",
        "matched_alias": "武进区"
      },
      "schema_version": "1.0.0"
    },
    {
      "entity_id": "ent_sunshine_garden",
      "entity_type": "LOCATION",
      "entity_subtype": "RESIDENTIAL_COMPOUND",
      "canonical_name": "阳光花园",
      "normalized_name": "阳光花园",
      "aliases": ["阳光花园"],
      "administrative_code": null,
      "parent_entity_id": "ent_wujin",
      "sensitivity": "public",
      "attributes": {"area": "武进区"},
      "resolution": {
        "method": "new_entity",
        "confidence": 0.9,
        "review_status": "accepted",
        "resolver_version": "demo-v1",
        "matched_alias": null
      },
      "schema_version": "1.0.0"
    },
    {
      "entity_id": "ent_daily_after_22",
      "entity_type": "TEMPORAL_EXPRESSION",
      "entity_subtype": "RECURRENCE",
      "canonical_name": "每天22时后",
      "normalized_name": "每天22:00后",
      "aliases": ["每天22时后"],
      "administrative_code": null,
      "parent_entity_id": null,
      "sensitivity": "public",
      "attributes": {"recurrence": "daily", "start_time": "22:00"},
      "resolution": {
        "method": "rule",
        "confidence": 0.98,
        "review_status": "accepted",
        "resolver_version": "demo-v1",
        "matched_alias": null
      },
      "schema_version": "1.0.0"
    },
    {
      "entity_id": "ent_construction_noise",
      "entity_type": "ISSUE_TYPE",
      "entity_subtype": "NOISE",
      "canonical_name": "施工噪声",
      "normalized_name": "施工噪声",
      "aliases": ["施工噪声"],
      "administrative_code": null,
      "parent_entity_id": null,
      "sensitivity": "public",
      "attributes": {},
      "resolution": {
        "method": "dictionary",
        "confidence": 0.98,
        "review_status": "accepted",
        "resolver_version": "demo-v1",
        "matched_alias": "施工噪声"
      },
      "schema_version": "1.0.0"
    },
    {
      "entity_id": "ent_construction",
      "entity_type": "ACTION_BEHAVIOR",
      "entity_subtype": "CONSTRUCTION",
      "canonical_name": "施工",
      "normalized_name": "施工",
      "aliases": ["施工"],
      "administrative_code": null,
      "parent_entity_id": null,
      "sensitivity": "public",
      "attributes": {},
      "resolution": {
        "method": "dictionary",
        "confidence": 0.98,
        "review_status": "accepted",
        "resolver_version": "demo-v1",
        "matched_alias": "施工"
      },
      "schema_version": "1.0.0"
    },
    {
      "entity_id": "ent_huajian",
      "entity_type": "ORGANIZATION",
      "entity_subtype": "CONTRACTOR",
      "canonical_name": "华建工程公司",
      "normalized_name": "华建工程公司",
      "aliases": ["华建工程公司"],
      "administrative_code": null,
      "parent_entity_id": null,
      "sensitivity": "public",
      "attributes": {},
      "resolution": {
        "method": "new_entity",
        "confidence": 0.75,
        "review_status": "accepted",
        "resolver_version": "demo-v1",
        "matched_alias": null
      },
      "schema_version": "1.0.0"
    },
    {
      "entity_id": "ent_housing_department",
      "entity_type": "GOVERNMENT_DEPARTMENT",
      "entity_subtype": "HANDLING_DEPARTMENT",
      "canonical_name": "住房和城乡建设部门",
      "normalized_name": "住房和城乡建设部门",
      "aliases": ["住建部门"],
      "administrative_code": null,
      "parent_entity_id": null,
      "sensitivity": "public",
      "attributes": {},
      "resolution": {
        "method": "dictionary",
        "confidence": 0.95,
        "review_status": "accepted",
        "resolver_version": "demo-v1",
        "matched_alias": "住建部门"
      },
      "schema_version": "1.0.0"
    }
  ],
  "entity_mentions": [
    {
      "mention_id": "men_wujin",
      "document_id": "co_demo001",
      "entity_id": "ent_wujin",
      "surface_form": "武进区",
      "normalized_mention": "武进区",
      "source_span": {"field": "case_content", "start": 4, "end": 7, "text": "武进区", "redacted": true},
      "confidence": 1.0,
      "extraction_run_id": "run_demo_v1",
      "schema_version": "1.0.0"
    },
    {
      "mention_id": "men_sunshine",
      "document_id": "co_demo001",
      "entity_id": "ent_sunshine_garden",
      "surface_form": "阳光花园",
      "normalized_mention": "阳光花园",
      "source_span": {"field": "case_content", "start": 7, "end": 11, "text": "阳光花园", "redacted": true},
      "confidence": 0.95,
      "extraction_run_id": "run_demo_v1",
      "schema_version": "1.0.0"
    },
    {
      "mention_id": "men_time",
      "document_id": "co_demo001",